{
    "$schema": "http://json-schema.org/draft-06/schema#",
    "$id": "https://standards-ontotest.oftrust.net/v2/Schema/DataProductParameters/Report/OrganizationTrustCategory",
    "type": "object",
    "required": [],
    "properties": {
        "@context": {
            "$id": "#/properties/@context",
            "type": "string",
            "const": "https://standards-ontotest.oftrust.net/v2/Context/DataProductParameters/Report/OrganizationTrustCategory/",
            "title": "JSON-LD context url",
            "description": "JSON-LD context url with terms required to understand data product content."
        },
        "productCode": {
            "$id": "#/properties/productCode",
            "type": "string",
            "title": "Product code",
            "description": "Product code."
        },
        "timestamp": {
            "$id": "#/properties/timestamp",
            "type": "string",
            "title": "Time stamp",
            "description": "Time stamp."
        },
        "parameters": {
            "$id": "#/properties/parameters",
            "type": "object",
            "title": "Data product parameters",
            "description": "Data product parameters.",
            "required": [],
            "properties": {
                "registrationCountry": {
                    "$id": "#/properties/parameters/properties/registrationCountry",
                    "type": "string",
                    "title": "Registration Country",
                    "description": "Country in which the organization is registered."
                },
                "idOfficial": {
                    "$id": "#/properties/parameters/properties/idOfficial",
                    "type": "string",
                    "title": "Official identifier",
                    "description": "Government (official authority) assigned identifier."
                }
            }
        }
    }
}