{
   "@context":"https://standards-ontotest.oftrust.net/v2/Context/DataProductParameters/Report/OrganizationTrustCategory/",
   "productCode":"multidata-product-1",
   "timestamp":"2019-10-19T13:20:09+00:00",
   "parameters":{
      "registrationCountry":"Finland",
      "idOfficial":"1234567-1"
   }
}